{"schema_version":1,"snapshot_id":"synthetic-admin-disabled","observed_at":"2026-10-05T00:00:00Z","adapter":{"id":"codex","version":"0.1.0","manifest_digest":"sha256:aaaaaaaaaaaaaaaaaaaaaaaaaaaaaaaaaaaaaaaaaaaaaaaaaaaaaaaaaaaaaaaa","implementation_digest":"sha256:bbbbbbbbbbbbbbbbbbbbbbbbbbbbbbbbbbbbbbbbbbbbbbbbbbbbbbbbbbbbbbbb"},"host":{"tool_provider":"codex","version":"0.160.0","version_source":"host_schema"},"context":{"scope":"session"},"lifecycle":{"registered":true,"installed":true,"enabled":true,"adapter_trust":"trusted","host_trust":"unknown"},"capabilities":[{"key":"tool.pre.observe","state":"admin-disabled","reason_codes":["host_admin_disabled"],"limits":{"source":"synthetic_example"},"evidence":[{"kind":"admin_observation","observed_at":"2026-10-05T00:00:00Z","source_ref":"synthetic://host/admin-state","result":"disabled"}]}]}
