{"schema_version":1,"snapshot_id":"synthetic-codex-a","observed_at":"2026-10-05T00:00:00Z","adapter":{"id":"codex","version":"0.1.0","manifest_digest":"sha256:aaaaaaaaaaaaaaaaaaaaaaaaaaaaaaaaaaaaaaaaaaaaaaaaaaaaaaaaaaaaaaaa","implementation_digest":"sha256:bbbbbbbbbbbbbbbbbbbbbbbbbbbbbbbbbbbbbbbbbbbbbbbbbbbbbbbbbbbbbbbb"},"host":{"tool_provider":"codex","version":"0.160.0","version_source":"host_schema"},"context":{"scope":"session"},"lifecycle":{"registered":true,"installed":true,"enabled":true,"adapter_trust":"trusted","host_trust":"unknown"},"capabilities":[{"key":"tool.pre.observe","state":"unknown","reason_codes":["host_capture_pending"],"limits":{"event_classes":["PreToolUse"],"execution_mode":"unknown","failure_behavior":"unknown"},"evidence":[{"kind":"host_schema","observed_at":"2026-10-05T00:00:00Z","source_ref":"synthetic://codex-v0.160.0/schema-example","result":"shape_only"}]}]}
