{"schema_version":1,"snapshot_id":"synthetic-claude-a","observed_at":"2026-10-05T00:00:00Z","adapter":{"id":"claude_code","version":"1.0.0","manifest_digest":"sha256:aaaaaaaaaaaaaaaaaaaaaaaaaaaaaaaaaaaaaaaaaaaaaaaaaaaaaaaaaaaaaaaa","implementation_digest":"sha256:bbbbbbbbbbbbbbbbbbbbbbbbbbbbbbbbbbbbbbbbbbbbbbbbbbbbbbbbbbbbbbbb"},"host":{"tool_provider":"claude_code","version":null,"version_source":"unknown"},"context":{"scope":"unknown"},"lifecycle":{"registered":true,"installed":false,"enabled":false,"adapter_trust":"trusted","host_trust":"untrusted"},"capabilities":[{"key":"permission.request.approve","state":"trust-required","reason_codes":["host_trust_missing"],"limits":{},"evidence":[{"kind":"trust_observation","observed_at":"2026-10-05T00:00:00Z","source_ref":"synthetic://claude/trust-state","result":"not_trusted"}]}]}
